{
  "$schema": "https://json-schema.org/draft/2020-12/schema",
  "title": "hobkg LLM extraction output",
  "type": "object",
  "required": [
    "face_id",
    "abilities",
    "proposed_edges",
    "schema_extension_requests"
  ],
  "additionalProperties": false,
  "properties": {
    "face_id": {
      "type": "string"
    },
    "abilities": {
      "type": "array",
      "items": {
        "type": "object",
        "required": [
          "ability_id",
          "kind",
          "effects",
          "oracle_spans",
          "confidence",
          "unresolved"
        ],
        "additionalProperties": true,
        "properties": {
          "ability_id": {
            "type": "string"
          },
          "kind": {
            "enum": [
              "triggered",
              "activated",
              "static",
              "replacement",
              "spell_effect"
            ]
          },
          "trigger": {
            "type": [
              "object",
              "null"
            ]
          },
          "costs": {
            "type": "array"
          },
          "conditions": {
            "type": "array"
          },
          "effects": {
            "type": "array"
          },
          "oracle_spans": {
            "type": "array",
            "minItems": 1,
            "items": {
              "type": "array",
              "items": {
                "type": "integer"
              },
              "minItems": 2,
              "maxItems": 2
            }
          },
          "confidence": {
            "enum": [
              "high",
              "medium",
              "low"
            ]
          },
          "unresolved": {
            "type": "array",
            "items": {
              "type": "string"
            }
          }
        }
      }
    },
    "proposed_edges": {
      "type": "array",
      "items": {
        "type": "object",
        "required": [
          "source",
          "target",
          "predicate",
          "provenance"
        ],
        "additionalProperties": true,
        "properties": {
          "source": {
            "type": "string"
          },
          "target": {
            "type": "string"
          },
          "predicate": {
            "enum": [
              "HAS_FACE",
              "HAS_ABILITY",
              "HAS_TYPE",
              "HAS_KEYWORD",
              "HAS_COST",
              "REQUIRES",
              "CONSUMES",
              "PRODUCES",
              "CAUSES",
              "TRIGGERS",
              "MODIFIES",
              "COUNTS",
              "CONTRIBUTES_TO",
              "SATISFIES",
              "ENABLES",
              "PREVENTS",
              "REPLACES",
              "MOVES_FROM",
              "MOVES_TO",
              "CREATES_OBJECT",
              "ADDS_COUNTER",
              "REMOVES_COUNTER",
              "SCALES_WITH",
              "PERSISTS_AS",
              "REFERENCES_RULE",
              "DERIVED_FROM",
              "CAN_LEAD_TO",
              "INSTANTIATES",
              "QUALIFIES_FOR",
              "HAS_COUNTER_TYPE",
              "ATTACHED_TO",
              "HAS_STATE"
            ]
          },
          "polarity": {
            "enum": [
              "positive",
              "negative"
            ]
          },
          "timing": {
            "type": [
              "string",
              "null"
            ]
          },
          "scope": {
            "type": [
              "string",
              "null"
            ]
          },
          "optional": {
            "type": "boolean"
          },
          "condition": {
            "type": [
              "string",
              "object",
              "null"
            ]
          },
          "certainty": {
            "enum": [
              "rules_explicit",
              "high",
              "medium",
              "low"
            ]
          },
          "provenance": {
            "type": "object",
            "properties": {
              "oracle_span": {
                "type": "array",
                "items": {
                  "type": "integer"
                },
                "minItems": 2,
                "maxItems": 2
              },
              "text": {
                "type": "string"
              },
              "rule_ref": {
                "type": "string"
              },
              "note": {
                "type": "string"
              }
            },
            "additionalProperties": true
          }
        }
      }
    },
    "schema_extension_requests": {
      "type": "array",
      "items": {
        "type": "object",
        "required": [
          "proposed_predicate",
          "rationale"
        ],
        "additionalProperties": false,
        "properties": {
          "proposed_predicate": {
            "type": "string"
          },
          "rationale": {
            "type": "string"
          },
          "oracle_span": {
            "type": "array",
            "items": {
              "type": "integer"
            }
          }
        }
      }
    }
  }
}