{
  "face_id": "face:5c5bfbb2-0e63-4e43-b441-c4878983288f:0",
  "abilities": [
    {
      "ability_id": "a1",
      "kind": "static",
      "conditions": [
        {
          "type": "control",
          "requirement": "you control a Human"
        }
      ],
      "effects": [
        {
          "op": "grant_cast_permission",
          "note": "you may cast this spell as though it had flash",
          "keyword": "flash"
        }
      ],
      "controller": "you",
      "oracle_spans": [
        [
          0,
          69
        ]
      ],
      "confidence": "high",
      "unresolved": []
    },
    {
      "ability_id": "a2",
      "kind": "static",
      "effects": [
        {
          "op": "modify_pt",
          "delta": "+1/+1",
          "target": "other creatures you control"
        }
      ],
      "controller": "you",
      "oracle_spans": [
        [
          70,
          109
        ]
      ],
      "confidence": "high",
      "unresolved": []
    },
    {
      "ability_id": "a3",
      "kind": "triggered",
      "trigger": {
        "event": "enters_or_attacks",
        "subject": "this creature"
      },
      "effects": [
        {
          "op": "recruit",
          "note": "draw a card, then discard a card; if discarded card was nonland, create a 1/1 white Human Soldier token"
        }
      ],
      "controller": "you",
      "keyword": "Recruit",
      "oracle_spans": [
        [
          110,
          277
        ]
      ],
      "confidence": "high",
      "unresolved": []
    }
  ],
  "proposed_edges": [
    {
      "source": "state:control-human",
      "target": "a1",
      "predicate": "ENABLES",
      "certainty": "rules_explicit",
      "provenance": {
        "oracle_span": [
          0,
          69
        ],
        "text": "You may cast this spell as though it had flash if you control a Human.",
        "note": "controlling a Human enables casting this spell as though it had flash"
      }
    },
    {
      "source": "face:5c5bfbb2-0e63-4e43-b441-c4878983288f:0",
      "target": "face:5c5bfbb2-0e63-4e43-b441-c4878983288f:0",
      "predicate": "MODIFIES",
      "polarity": "positive",
      "scope": "other creatures you control",
      "certainty": "rules_explicit",
      "provenance": {
        "oracle_span": [
          71,
          109
        ],
        "text": "Other creatures you control get +1/+1.",
        "note": "static anthem for other creatures you control"
      }
    },
    {
      "source": "face:5c5bfbb2-0e63-4e43-b441-c4878983288f:0",
      "target": "rule:recruit",
      "predicate": "REFERENCES_RULE",
      "certainty": "rules_explicit",
      "provenance": {
        "oracle_span": [
          110,
          160
        ],
        "text": "Whenever this creature enters or attacks, recruit.",
        "rule_ref": "HOB release notes / mechanics article: Recruit"
      }
    },
    {
      "source": "face:5c5bfbb2-0e63-4e43-b441-c4878983288f:0",
      "target": "token:human-soldier",
      "predicate": "CREATES_OBJECT",
      "certainty": "rules_explicit",
      "condition": "if you discarded a nonland card via recruit",
      "provenance": {
        "oracle_span": [
          196,
          277
        ],
        "text": "If you discarded a nonland card, create a 1/1 white Human Soldier creature token.",
        "note": "conditional token from recruit"
      }
    }
  ],
  "schema_extension_requests": []
}