{
  "face_id": "face:6505a53b-00db-44c4-8eaa-09a1a01451a4:1",
  "abilities": [
    {
      "ability_id": "6505a53b1-a1",
      "kind": "spell_effect",
      "trigger": null,
      "costs": [],
      "conditions": [],
      "effects": [
        { "op": "deal_damage", "amount": 1, "target": "each creature your opponents control", "required": true, "text": "Easy Pickings deals 1 damage to each creature your opponents control." }
      ],
      "oracle_spans": [[0, 68]],
      "confidence": "high",
      "unresolved": []
    }
  ],
  "proposed_edges": [
    { "source": "face:6505a53b-00db-44c4-8eaa-09a1a01451a4:1", "target": "6505a53b1-a1", "predicate": "HAS_ABILITY", "provenance": { "oracle_span": [0, 68], "text": "Easy Pickings deals 1 damage to each creature your opponents control." } },
    { "source": "face:6505a53b-00db-44c4-8eaa-09a1a01451a4:1", "target": "rule:adventure", "predicate": "REFERENCES_RULE", "certainty": "rules_explicit", "provenance": { "oracle_span": [70, 137], "text": "(Then exile this card. You may cast the creature later from exile.)", "note": "Adventure face" } },
    { "source": "6505a53b1-a1", "target": "op:deal-damage", "predicate": "CAUSES", "polarity": "negative", "provenance": { "oracle_span": [0, 68], "text": "deals 1 damage to each creature your opponents control" } },
    { "source": "face:6505a53b-00db-44c4-8eaa-09a1a01451a4:1", "target": "face:6505a53b-00db-44c4-8eaa-09a1a01451a4:0", "predicate": "CAN_LEAD_TO", "certainty": "rules_explicit", "condition": "after resolving, this card is exiled and the creature face may be cast later from exile", "provenance": { "oracle_span": [70, 137], "text": "(Then exile this card. You may cast the creature later from exile.)" } }
  ],
  "schema_extension_requests": []
}
