{
  "face_id": "face:27e17542-549b-4c05-8091-c10a245c916b:1",
  "abilities": [
    {
      "ability_id": "clapsnap-amass",
      "kind": "spell_effect",
      "trigger": null,
      "costs": [],
      "conditions": [],
      "effects": [
        {
          "op": "amass",
          "subtype": "Goblins",
          "amount": 2,
          "detail": "Put two +1/+1 counters on an Army you control (it becomes a Goblin); if you control no Army, first create a 0/0 black Goblin Army creature token.",
          "references_mechanic": "Amass"
        }
      ],
      "oracle_spans": [[0, 16]],
      "confidence": "high",
      "unresolved": []
    },
    {
      "ability_id": "clapsnap-adventure",
      "kind": "spell_effect",
      "trigger": null,
      "costs": [],
      "conditions": [],
      "effects": [
        {
          "op": "adventure_exile",
          "detail": "Then exile this card; you may cast the creature face later from exile.",
          "references_mechanic": "Adventure"
        }
      ],
      "oracle_spans": [[17, 84]],
      "confidence": "high",
      "unresolved": []
    }
  ],
  "proposed_edges": [
    {
      "source": "face:27e17542-549b-4c05-8091-c10a245c916b:1",
      "target": "keyword:amass",
      "predicate": "REFERENCES_RULE",
      "certainty": "rules_explicit",
      "provenance": {
        "oracle_span": [0, 16],
        "text": "Amass Goblins 2.",
        "rule_ref": "Amass (keyword action)"
      }
    },
    {
      "source": "face:27e17542-549b-4c05-8091-c10a245c916b:1",
      "target": "counter:+1/+1",
      "predicate": "ADDS_COUNTER",
      "scope": "an Army you control",
      "certainty": "rules_explicit",
      "provenance": {
        "oracle_span": [0, 16],
        "text": "Amass Goblins 2.",
        "note": "Amass Goblins 2 puts two +1/+1 counters on an Army."
      }
    },
    {
      "source": "face:27e17542-549b-4c05-8091-c10a245c916b:1",
      "target": "token:goblin-army",
      "predicate": "CREATES_OBJECT",
      "condition": "if you control no Army",
      "certainty": "rules_explicit",
      "provenance": {
        "oracle_span": [0, 16],
        "text": "Amass Goblins 2.",
        "note": "Creates a 0/0 black Goblin Army token first if you control no Army."
      }
    },
    {
      "source": "face:27e17542-549b-4c05-8091-c10a245c916b:1",
      "target": "rule:adventure",
      "predicate": "REFERENCES_RULE",
      "certainty": "rules_explicit",
      "provenance": {
        "oracle_span": [17, 84],
        "text": "(Then exile this card. You may cast the creature later from exile.)"
      }
    },
    {
      "source": "face:27e17542-549b-4c05-8091-c10a245c916b:1",
      "target": "zone:exile",
      "predicate": "MOVES_TO",
      "certainty": "rules_explicit",
      "provenance": {
        "oracle_span": [17, 84],
        "text": "(Then exile this card. You may cast the creature later from exile.)"
      }
    }
  ],
  "schema_extension_requests": []
}
